### ISSUE TITLE
dig_srv: SERVFAIL not handled properly

### ISSUE THREAD

**Issue by drybjed** [debops/debops#2001]
Looks like the `dig_srv` plugin should handle a few more cases - the SERVFAIL errors in an unhandled exception:
```
TASK [debops.debops.nullmailer : Generate configuration files] ****************************************************************************************************************************************************
fatal: [host.example.org]: FAILED! => 
  msg: 'An unhandled exception occurred while templating ''[{''dest'': ''/etc/mailname'', ''content'': ''{{ nullmailer__mailname }}''}, {''dest'': ''/etc/nullmailer/adminaddr'', ''content'': ''{{ nullmailer__adminaddr if nullmailer__adminaddr is string else nullmailer__adminaddr|join(",") }}''}, {''dest'': ''/etc/nullmailer/idhost'', ''content'': ''{{ nullmailer__idhost }}'', ''mode'': ''0644'', ''state'': ''{{ "present" if nullmailer__idhost else "absent" }}''}, {''dest'': ''/etc/nullmailer/helohost'', ''content'': ''{{ nullmailer__helohost }}'', ''mode'': ''0644'', ''state'': ''{{ "present" if nullmailer__helohost else "absent" }}''}, {''dest'': ''/etc/nullmailer/defaulthost'', ''content'': ''{{ nullmailer__defaulthost }}'', ''mode'': ''0644'', ''state'': ''{{ "present" if nullmailer__defaulthost else "absent" }}''}, {''dest'': ''/etc/nullmailer/defaultdomain'', ''content'': ''{{ nullmailer__defaultdomain }}'', ''mode'': ''0644'', ''state'': ''{{ "present" if nullmailer__defaultdomain else
    "absent" }}''}, {''dest'': ''/etc/nullmailer/maxpause'', ''content'': ''{{ nullmailer__maxpause }}'', ''mode'': ''0644'', ''state'': ''{{ "present" if nullmailer__maxpause else "absent" }}''}, {''dest'': ''/etc/nullmailer/pausetime'', ''content'': ''{{ nullmailer__pausetime }}'', ''mode'': ''0644'', ''state'': ''{{ "present" if nullmailer__pausetime else "absent" }}''}, {''dest'': ''/etc/nullmailer/sendtimeout'', ''content'': ''{{ nullmailer__sendtimeout }}'', ''mode'': ''0644'', ''state'': ''{{ "present" if nullmailer__sendtimeout else "absent" }}''}, {''dest'': ''/etc/nullmailer/allmailfrom'', ''content'': ''{{ nullmailer__allmailfrom }}'', ''mode'': ''0644'', ''state'': ''{{ "present" if nullmailer__allmailfrom else "absent" }}''}]''. Error was a <class ''ansible.errors.AnsibleError''>, original message: An unhandled exception occurred while templating ''[''{{ "root@" + nullmailer__relayhost }}'']''. Error was a <class ''ansible.errors.AnsibleError''>, original message: An unhandled
    exception occurred while templating ''{{ nullmailer__smtp_srv_rr[0]["target"] }}''. Error was a <class ''ansible.errors.AnsibleError''>, original message: An unhandled exception occurred while templating ''{{ q("dig_srv", "_smtp._tcp." + nullmailer__domain, "smtp." + nullmailer__domain, 25) }}''. Error was a <class ''ansible.errors.AnsibleError''>, original message: An unhandled exception occurred while running the lookup plugin ''dig_srv''. Error was a <class ''ansible.errors.AnsibleError''>, original message: dig_srv: unhandled exception All nameservers failed to answer the query _smtp._tcp.example.org. IN SRV: Server 127.0.0.1 UDP port 53 answered SERVFAIL. dig_srv: unhandled exception All nameservers failed to answer the query _smtp._tcp.example.org. IN SRV: Server 127.0.0.1 UDP port 53 answered SERVFAIL'
```

@Alphix Any chance you could look into this?

**Comment by drybjed** [comment]
Some more details. The queries are done for records like `_syslog._tcp.example.org` but then if they are not answered, somehow this is changed to `_syslog._tcp.example.org.localdomain.com`, not sure what might be the reason for this... @scibi reported the issue, perhaps he can shed some more light regarding his environment.

**Comment by scibi** [comment]
Here are the queries sent to my local unbound (which forwards queries for `example.org` to remote server over a VPN and queries for `localdomain.com` to a server in my local network):

```
18:26:57.319007 IP localhost.38839 > localhost.domain: 41398+ [1au] SRV? _syslog._tcp.example.org. (61)
18:26:57.323216 IP localhost.domain > localhost.38839: 41398 NXDomain 0/1/1 (111)
18:26:57.324305 IP localhost.42475 > localhost.domain: 34930+ [1au] SRV? _syslog._tcp.example.org.localdomain.com. (74)
18:26:57.326785 IP localhost.domain > localhost.42475: 34930 ServFail 0/0/1 (74)
18:26:57.350586 IP localhost.44053 > localhost.domain: 61681+ [1au] SRV? _syslog._tcp.example.org. (61)
18:26:57.350716 IP localhost.domain > localhost.44053: 61681 NXDomain 0/1/1 (111)
18:26:57.351476 IP localhost.46999 > localhost.domain: 4179+ [1au] SRV? _syslog._tcp.example.org.localdomain.com. (74)
18:26:57.351574 IP localhost.domain > localhost.46999: 4179 ServFail 0/0/1 (74)
```

My `/etc/resolv.conf` looks like this:

```
nameserver 127.0.0.1
search localdomain.com
```

**Comment by Alphix** [comment]
@drybjed : I've had a quick look, some thougths:

First a query is made for `_syslog._tcp.example.org`...which is then presumably forwarded to the remote server over the VPN. That server answers with NXDOMAIN. The `search localdomain.com` part of `/etc/resolv.conf` is then appended to create `_syslog._tcp.example.org.localdomain.com` (that's how short hostnames are usually resolved).

That query is then sent to the local server....which doesn't answer with NXDOMAIN, but with SERVFAIL (and `dig_srv` *should* error out in that case, but I think a change in behaviour has been introduced by omitting the trailing period in the query in the nullmailer role).

@scibi : could you:

a) Add a period to the query in the nullmailer role (in `ansible/roles/nullmailer/defaults/main.yml`):

i.e. change this:
```
nullmailer__smtp_srv_rr: '{{ q("dig_srv", "_smtp._tcp." + nullmailer__domain,
                               "smtp." + nullmailer__domain, 25) }}'
```
into this:
```
nullmailer__smtp_srv_rr: '{{ q("dig_srv", "_smtp._tcp." + nullmailer__domain + ".",
                               "smtp." + nullmailer__domain, 25) }}'
```

b) check your local DNS server to try to figure out why it returns SERVFAIL instead of NXDOMAIN?

**Comment by Alphix** [comment]
(If my guess of the underlying issue is correct, I'd suggest that we change `dig_srv` to add a trailing period to any query which doesn't end with one)

**Comment by drybjed** [comment]
Sure, trailing period seems like a reasonable solution. I don't think that partial domain searches, ie. not FQDNs, will be useful with this plugin.

**Comment by Alphix** [comment]
I'll whip up a PR, but might want to hold on committing it until @scibi confirms that the trailing period fixes it?.....and that SERVFAIL from the local resolver is probably something that @scibi might want to look into independently of this issue....

**Comment by Alphix** [comment]
BTW, the issue title is misleading. SERVFAIL is handled properly (SERVFAIL is to DNS servers what 503 is to a HTTP server)...the only issue is the missing trailing period which causes DNS resolution to fallback to also using search domains.
